title,author,my_rating,avg_rating,publisher,binding,pages,year_published,month_read,year_read,bookshelf"""13 1/2""","Barr, Nevada",3,3.3,Vanguard Press,Hardcover,320,2009,May,2011,readA Civil War: Army vs. Navy - A Year Inside College Football's Purest Rivalry,"Feinstein, John",4,4.23,Back Bay Books,Hardcover,464,2014,September,2014,read"A Clash of Kings  (A Song of Ice and Fire, #2)","Martin, George R.R.",5,4.39,Bantam,Paperback,778,1998,August,2015,read"A Feast for Crows (A Song of Ice and Fire, #4)",George R.R. Martin,4,4.06,Bantam,Paperback,1060,2006,November,2015,readA Game of Thrones (A Song of Ice and Fire #1),"Martin, George R.R.",5,4.43,Harper Voyager,Paperback,801,1996,June,2015,readA March to Madness: The View from the Floor in the Atlantic Coast Conference,"Feinstein, John",3,4.03,Back Bay Books,Hardcover,464,1998,December,2010,readA Passion to Win,"Nanne, Lou",3,3.2,Triumph Books,Hardcover,256,2010,November,2013,readA Question of Attraction,"Nicholls, David",5,3.57,Villard,Hardcover,352,2003,July,2012,readA Spot of Bother,"Haddon, Mark",4,3.45,Doubleday,Hardcover,354,2006,June,2015,read"A Storm of Swords (A Song of Ice and Fire, #3)",George R.R. Martin,5,4.54,Bantam,Paperback,1177,2003,September,2015,read"A Stroke of Midnight (Merry Gentry, #4)","Hamilton, Laurell K.",3,4.05,Ballantine Books,Hardcover,366,2005,August,2015,readAbraham Lincoln: Vampire Hunter,"Grahame-Smith, Seth",,3.69,Grand Central Publishing,Hardcover,336,2010,December,2012,quit-readingAcademic Duty,"Kennedy, Donald",5,3.74,Harvard University Press,Hardcover,310,1997,July,2013,readAcademically Adrift: Limited Learning on College Campuses,"Arum, Richard",,3.32,University Of Chicago Press,Paperback,272,2010,March,2011,to-readAcademy X,"Trees, Andrew",4,2.64,Bloomsbury USA,Hardcover,224,2006,June,2011,read"After Dead: What Came Next in the World of Sookie Stackhouse (Sookie Stackhouse, #13.5)","Harris, Charlaine",,2.67,Ace,Hardcover,208,2013,October,2013,to-read"Against All Enemies (Max Moore, #1)","Clancy, Tom",4,3.95,Putnam Adult,Hardcover,756,2011,December,2012,readAleister Crowley: The Beast Demystified,"Hutchinson, Roger",,3.15,Mainstream Publishing,Paperback,224,1998,September,2013,quit-readingAll the Sad Young Literary Men,"Gessen, Keith",4,2.9,Viking Adult,Hardcover,242,2008,November,2011,readAlways Looking: Essays on Art,"Updike, John",,3.78,Knopf,Hardcover,224,2012,April,2015,quit-reading"American Gods (American Gods, #1)","Gaiman, Neil",,4.1,Headline Review,Hardcover,656,2001,January,2015,quit-readingAn Accidental Statistician: The Life and Memories of George E. P. Box,"Box, George E.P.",4,3.35,John Wiley & Sons,Hardcover,275,2013,June,2013,read"Angelology (Angelology, #1)","Trussoni, Danielle",4,3.39,Viking,Hardcover,464,2010,May,2011,readAngelopolis,"Trussoni, Danielle",4,3.34,Penguin Audio,Audio CD,320,2013,April,2013,readAnti-Intellectualism in American Life,"Hofstadter, Richard",,4.21,"Random House, Inc.",Paperback,459,1963,September,2012,to-readArchimedes Codex,"Netz, Reviel",3,3.85,Weidenfeld & Nicolson,Hardcover,305,2007,January,2011,read"Are You There, Vodka? It's Me, Chelsea","Handler, Chelsea",3,3.84,HarperCollins Publishers,Hardcover,264,2007,April,2011,readArmageddon in Retrospect,"Vonnegut, Kurt",4,3.92,G.P. Putnam's Sons,Hardcover,234,2008,March,2015,readAtonement,"McEwan, Ian",,3.85,Nan A. Talese,Hardcover,351,2001,May,2013,quit-readingBacchus & Me: Adventures in the Wine Cellar,"McInerney, Jay",,3.45,Lyons Press,Hardcover,308,2000,October,2013,quit-readingBag Men: A Novel,"Flood, John",3,3.23,W. W. Norton & Company,Hardcover,256,1997,June,2011,readBaseball Hacks: Tips & Tools for Analyzing and Winning with Statistics,"Adler, Joseph",4,3.48,O'Reilly Media,Paperback,472,2006,July,2011,readBetween a Heart and a Rock Place,Pat Benatar,3,3.64,William Morrow & Company,Hardcover,247,2010,October,2015,readBetween You & Me: Confessions of a Comma Queen,"Norris, Mary",5,3.54,W. W. Norton & Company,Hardcover,228,2015,April,2015,readBlind Submission,"Ginsberg, Debra",3,3.29,Shaye Areheart Books,Hardcover,328,2006,September,2011,readBonk: The Curious Coupling of Science and Sex,"Roach, Mary",4,3.81,W. W. Norton & Company,Hardcover,319,2008,June,2011,readBook of Days: Personal Essays,"Gordon, Emily Fox",,3.11,Spiegel & Grau,Paperback,320,2010,January,2015,to-readBooks,"McMurtry, Larry",4,3.15,Simon & Schuster,Hardcover,259,2008,April,2015,readBridge of Sighs,"Russo, Richard",5,3.77,Knopf,Hardcover,528,2007,October,2013,readBrightness Falls,"McInerney, Jay",4,3.71,Alfred a Knopf,Hardcover,415,1992,June,2014,readCaldecott and Co.: Notes on Books and Pictures,"Sendak, Maurice",4,4.29,Noonday Press,Hardcover,216,1988,January,2015,readCalico Joe,"Grisham, John",4,3.78,Doubleday,Hardcover,198,2012,February,2013,readCare of Wooden Floors,"Wiles, Will",,3.27,Harper Press,Hardcover,295,2012,June,2014,to-readCatalyst,"Anderson, Laurie Halse",3,3.61,Viking Juvenile,Hardcover,233,2014,August,2014,read"Catching Fire (The Hunger Games, #2)","Collins, Suzanne",3,4.31,Scholastic Press,Hardcover,405,2009,September,2012,readCheating Lessons: Learning from Academic Dishonesty,"Lang, James M.",,4.03,Harvard University Press,Hardcover,256,2013,December,2013,to-readColumbine,"Cullen, Dave",,4.24,Twelve,Hardcover,417,2009,April,2012,to-read"Command Authority (Jack Ryan, #9)","Clancy, Tom",4,4.07,G.P. Putnam's Sons,Hardcover,740,2013,August,2014,readConfessions of an Economic Hit Man,"Perkins, John",3,3.81,Plume,Hardcover,336,2004,September,2013,readConnected Code: Why Children Need to Learn Programming,"Kafai, Yasmin B.",,3.7,MIT Press (MA),Hardcover,181,2014,June,2015,quit-readingDead Babies,"Amis, Martin",,3.39,Vintage,Paperback,206,1975,July,2015,to-read"Dead Ever After (Sookie Stackhouse, #13)","Harris, Charlaine",2,3.31,Ace,Hardcover,338,2013,June,2013,read"Dead or Alive (Jack Ryan Jr., #2)","Clancy, Tom",4,3.76,G.P. Putnam's Sons,Hardcover,950,2010,December,2011,read"Dead Reckoning (Sookie Stackhouse, #11)","Harris, Charlaine",3,3.75,Ace Books,Hardcover,325,2011,July,2011,read"Deadlocked (Sookie Stackhouse, #12)","Harris, Charlaine",3,3.61,Ace Books,Hardcover,327,2012,July,2012,readDear Committee Members,Julie Schumacher,,3.77,Doubleday,Hardcover,181,2014,,2015,to-readDeath and the Penguin,"Kurkov, Andrey",4,3.82,Vintage,Paperback,228,1996,October,2011,read"Dexter in the Dark (Dexter, #3)","Lindsay, Jeff",4,3.47,Doubleday,Hardcover,302,2006,June,2011,read"Dexter's Final Cut (Dexter, #7)",Jeff Lindsay,3,3.5,Doubleday,Hardcover,352,2013,September,2015,readDigging for Dirt: The Life and Death of ODB,Jaime Lowe,3,3.27,Faber & Faber,Hardcover,288,2008,October,2015,readDigital Dice: Computational Solutions to Practical Probability Problems,"Nahin, Paul J.",3,3.96,Princeton University Press,Hardcover,263,2008,April,2011,readDistrust That Particular Flavor,"Gibson, William",3,3.76,G.P. Putnam's Sons,Hardcover,272,2012,June,2014,readDominance,"Lavender, Will",,3.41,Simon & Schuster,Hardcover,368,2011,August,2011,to-readDon't You Forget About Me,"Dunn, Jancee",4,3.1,Villard,Hardcover,276,2008,February,2012,read"Double Dexter (Dexter, #6)","Lindsay, Jeff",3,3.81,Doubleday,Hardcover,337,2011,November,2012,read"Dreaming in Code: Two Dozen Programmers, Three Years, 4,732 Bugs, and One Quest for Transcendent Software","Rosenberg, Scott",4,3.66,"Crown Publishing, NY",Hardcover,400,2007,December,2012,readEdge,"Deaver, Jeffery",5,3.97,Simon & Schuster,Hardcover,397,2010,January,2011,readEvidence-Based Policy: A Practical Guide to Doing It Better,"Cartwright, Nancy",3,3.43,"Oxford University Press, USA",Paperback,196,2012,December,2014,readEx Libris: Confessions of a Common Reader,"Fadiman, Anne",,4.17,"Farrar, Straus and Giroux",Paperback,162,1998,July,2015,to-readF*ck Feelings: One Shrink's Practical Advice for Managing All Life's Impossible Problems,Michael I. Bennett,,3.64,Simon & Schuster,Hardcover,384,2015,,2015,to-readFair Ball: A Fan's Case for Baseball,"Costas, Bob",4,3.61,Broadway,Hardcover,192,2000,April,2012,readFire In A Canebrake: The Last Mass Lynching In America,"Wexler, Laura",5,3.91,Scribner Book Company,Hardcover,271,2003,March,2011,readForever's Team,"Feinstein, John",4,3.88,Villard,Hardcover,375,1989,February,2014,readFortune's Formula: The Untold Story of the Scientific Betting System That Beat the Casinos and Wall Street,"Poundstone, William",3,4.13,Hill & Wang,Hardcover,400,2005,August,2012,read"Full Force and Effect (Jack Ryan, #10)","Greaney, Mark",4,4.21,Putnam Adult,Hardcover,674,2014,March,2015,readFunny Girl,"Hornby, Nick",3,3.37,Riverhead Books,Hardcover,452,2014,June,2015,readGeorgia Bottoms,"Childress, Mark",3,3.37,"Little, Brown and Company",Hardcover,288,2011,November,2011,readGlyph: A Visual Exploration of Punctuation Marks and Other Typographic Symbols,Adriana Caneva,,4.25,Cicada Books,Hardcover,112,2015,,2015,to-readGod is Not Great: How Religion Poisons Everything,"Hitchens, Christopher",4,3.93,Twelve Books,Hardcover,307,2007,March,2015,readGrade My Teacher: A Short Story,"Perrotta, Tom",,4.04,St. Martin's Press,ebook,17,2013,June,2015,to-readGraphic Discovery: A Trout in the Milk and Other Visual Adventures,"Wainer, Howard",4,3.78,Princeton University Press,Hardcover,192,2004,April,2012,readGray Mountain,"Grisham, John",,3.47,Doubleday,Hardcover,368,2014,October,2014,to-readGrotesque,"Kirino, Natsuo",3,3.66,Knopf,Hardcover,480,2003,May,2012,read"Headspin, Headshopts & History: Growing Up in Twin Cities Hip Hop",Zach Combs,0,0,Zach Combs,Paperback,277,2011,October,2015,quit-readingHere Comes Everybody,James Fearnley,,3.87,Faber & Faber,Paperback,406,2012,,2015,currently-readingHermann Zapf and His Design Philosophy,"Zapf, Hermann",5,3.75,Yale University Press,Hardcover,254,1987,June,2015,readHitch-22: A Memoir,"Hitchens, Christopher",4,4,Twelve,Hardcover,435,2010,January,2013,read"How's Your Drink?: Cocktails, Culture, and the Art of Drinking Well","Felten, Eric",,3.71,Agate Surrey,Hardcover,200,2007,July,2015,to-readHunting Eichmann: How a Band of Survivors and a Young Spy Agency Chased Down the World's Most Notorious Nazi,"Bascomb, Neal",5,4.13,Houghton Mifflin Harcourt,Hardcover,390,2009,January,2015,read"Hunting Season (Anna Pigeon, #10)","Barr, Nevada",4,3.82,G.P. Putnam's Sons,Hardcover,322,2002,January,2014,read"I Love You, Beth Cooper","Doyle, Larry",5,3.29,HarperCollins Publishers,Hardcover,255,2007,June,2013,readI Wear the Black Hat: Grappling With Villains (Real and Imagined),"Klosterman, Chuck",0,3.64,Scribner,Hardcover,214,2013,July,2014,readI'm with the Band: Confessions of a Groupie,"Barres, Pamela Des",3,3.67,Chicago Review Press,Paperback,320,1987,February,2015,readIn One Person,"Irving, John",,3.63,Simon & Schuster,Hardcover,425,2011,September,2014,quit-readingIn Secret Service,"Silver, Mitch",2,3.18,Touchstone Books,Hardcover,327,2007,June,2015,read"Inferno (Robert Langdon, #4)","Brown, Dan",3,3.73,Doubleday,Hardcover,461,2013,June,2013,readInteractive Data Visualization for the Web,"Murray, Scott",0,4.03,O'Reilly Media,Paperback,272,2013,June,2013,read"It Gets Better: Coming Out, Overcoming Bullying, and Creating a Life Worth Living","Savage, Dan",,4.12,Dutton,Hardcover,338,2011,December,2011,to-readJudgment Calls: Principle and Politics in Constitutional Law,"Farber, Daniel A.",,3.67,"Oxford University Press, USA",Hardcover,201,2008,February,2013,quit-reading"Juliet, Naked","Hornby, Nick",4,3.47,Riverhead Books,Hardcover,406,2009,February,2011,readJust My Type: A Book About Fonts,Simon Garfield,0,3.77,Gotham,Hardcover,384,2011,December,2015,readLast Dance: Behind the Scenes at the Final Four,"Feinstein, John",4,3.72,"Little, Brown and Company",Hardcover,384,2006,March,2011,readLast Night at Chateau Marmont,"Weisberger, Lauren",2,3.49,Atria Books,Hardcover,384,2010,December,2010,readLess Than Words Can Say (Common Reader Editions),"Mitchell, Richard",,4.41,Joiner/Oriel Inc,Paperback,224,1979,May,2015,quit-readingLet's Talk About Love: A Journey to the End of Taste,"Wilson, Carl",,4.19,Bloomsbury Academic,Paperback,176,2007,January,2015,to-readLetters to a Young Contrarian,"Hitchens, Christopher",4,4.12,Basic Books,Hardcover,141,2001,January,2015,read"Locked On (Jack Ryan Jr., #3)","Clancy, Tom",4,3.97,Michael Joseph,Hardcover,712,2011,May,2013,readLucky Jim,"Amis, Kingsley",4,3.79,Penguin Classics,Paperback,251,1953,May,2015,readMicro,"Crichton, Michael",3,3.32,Harper,Hardcover,429,2011,December,2012,read"Mockingjay (The Hunger Games, #3)","Collins, Suzanne",3,4.03,Scholastic Press,Hardcover,400,2010,October,2013,readModel Behavior: A Novel and Stories,"McInerney, Jay",3,3.18,Knopf,Hardcover,275,1998,April,2014,read"More Baths, Less Talking (Stuff I've Been Reading #4)","Hornby, Nick",4,3.93,"McSweeney's, Believer Books",Paperback,135,2012,January,2015,read"Motley Crue: A Visual History, 1983-2005","Zlozower, Neil",4,4.38,Chronicle Books,Hardcover,232,2009,May,2012,readMr. Penumbra's 24-Hour Bookstore,"Sloan, Robin",,3.76,"Farrar, Straus and Giroux",Hardcover,288,2012,June,2014,to-read"My Appetite for Destruction: Sex, and Drugs, and Guns N' Roses","Adler, Steven",3,3.53,It Books,Hardcover,286,2010,February,2012,readMy Custom Van: And 50 Other Mind-Blowing Essays that Will Blow Your Mind All Over Your Face,"Black, Michael Ian",5,3.66,Gallery Books,Hardcover,240,2008,January,2014,read"My Life as a Furry Red Monster: What Being Elmo Has Taught Me About Life, Love and Laughing Out Loud","Clash, Kevin",3,3.62,Crown Archetype,Hardcover,224,2006,January,2012,readNeruda Memoirs,"Neruda, Pablo",,4.2,Penguin Books,Paperback,370,1974,July,2015,quit-readingNever Mind Nirvana: A Novel,"Lindquist, Mark",4,3.62,Villard,Hardcover,256,2000,April,2013,readNight Film,"Pessl, Marisha",4,3.76,Random House,Hardcover,602,2013,December,2013,readNine Inches: Stories,"Perrotta, Tom",,3.72,St. Martin's Press,Hardcover,246,2013,September,2013,to-readNo Country for Old Men,"McCarthy, Cormac",5,4.11,Alfred A. Knopf,Hardcover,309,2005,January,2013,readNobody's Fool,"Russo, Richard",5,4.12,Vintage,Hardcover,549,1993,December,2014,read"Notorious (It Girl, #2)","Ziegesar, Cecily von",4,3.74,Poppy,Paperback,288,2006,January,2015,read"October, 1964","Halberstam, David",3,4.12,Niagara,Hardcover,576,1994,October,2011,readOn Equality of Educational Opportunity,"Mosteller, Frederick",4,4,Random House (NY),Hardcover,570,1972,January,2014,read"On Writing, Editing, and Publishing",Jacques Barzun,,3.95,The University of Chicago Press,Paperback,130,1972,,2015,currently-readingOnce Upon a Fastball,"Mitchell, Bob",3,2.97,Kensington,Hardcover,288,2008,January,2011,read"Once Upon a Time in Computerland: The Amazing, Billion-Dollar Tale of Bill Millard","Littman, Jonathan",3,4,Simon & Schuster,Paperback,413,1987,January,2015,readOne Fifth Avenue,Candace Bushnell,4,3.3,Hachette Books,Hardcover,433,2008,January,2016,readOne Mississippi,"Childress, Mark",5,3.67,"Little, Brown and Company",Hardcover,400,2006,June,2014,readPicking Federal Judges: Lower Court Selection from Roosevelt through Reagan,"Goldman, Sheldon",,3,Yale University Press,Paperback,448,1997,July,2015,quit-readingPirate Latitudes,"Crichton, Michael",4,3.36,Harper,Hardcover,312,2009,January,2012,readPlaying for Pizza,"Grisham, John",4,3.38,Doubleday Books,Hardcover,262,2007,May,2013,readPolar,"Pearson, T.R.",4,3.79,Viking Adult,Hardcover,244,2002,April,2014,readPraying for Sleep,"Deaver, Jeffery",4,3.79,Viking Books,Hardcover,437,1994,October,2011,readPsychotic Reactions and Carburetor Dung,"Bangs, Lester",,4.04,Anchor,Paperback,416,1987,July,2015,to-readPurple Dots: A Novel,"Lehrer, Jim",4,3.24,Random House,Hardcover,262,1998,September,2012,read"Random Family: Love, Drugs, Trouble, and Coming of Age in the Bronx","LeBlanc, Adrian Nicole",,4.22,Scribner,Paperback,432,2003,January,2015,to-readRansom,"McInerney, Jay",4,3.27,Vintage,Hardcover,279,1985,February,2014,readRay Christensen's Gopher Tales: Stories from All Eleven University of Minnesota's Men's Sports,"Christensen, Ray",4,4.5,Sports Publishing LLC,Hardcover,204,2002,June,2012,readReady Player One,"Cline, Ernest",5,4.31,Random House NY,Hardcover,374,2011,April,2015,readReamde,"Stephenson, Neal",4,3.94,William Morrow,Hardcover,1044,2011,July,2014,read"Reckless (It Girl, #3)","Ziegesar, Cecily von",4,3.76,Poppy,Paperback,288,2006,May,2015,readRembrandt's Whore,"Matton, Sylvie",2,3.38,Canongate Books,Hardcover,208,2001,July,2011,readRestitution,"Vance, Lee",4,3.51,Knopf,Hardcover,336,2007,April,2015,read"Revenge Wears Prada: The Devil Returns (The Devil Wears Prada, #2)","Weisberger, Lauren",3,2.78,Simon & Schuster,Hardcover,400,2015,July,2013,read"Road Work: Among Tyrants, Heroes, Rogues, and Beasts","Bowden, Mark",4,3.7,Penguin Books,Hardcover,480,2004,August,2015,read"Rogue Warrior (Rogue Warrior, #1)","Marcinko, Richard",3,3.94,Atria Books,Hardcover,336,1992,November,2014,readRomance of the Grail: The Magic and Mystery of Arthurian Myth,Joseph Campbell,,4.11,New World Library,Hardcover,304,2015,,2015,to-readSaint Mudd,"Thayer, Steve",4,3.78,Signet,Hardcover,384,1988,July,2015,readScent of the Missing: Love and Partnership with a Search-and-Rescue Dog,Susannah Charleson,3,4.03,Houghton Mifflin Harcourt,Hardcover,285,2010,November,2015,read"SEAL Team Six Outcasts (SEAL Team Six Outcasts, #1)","Wasdin, Howard E.",,3.94,Gallery Books,Hardcover,352,2012,December,2014,quit-readingSEAL Team Six: Memoirs of an Elite Navy SEAL Sniper,"Wasdin, Howard E.",4,3.98,St. Martin's Press,Hardcover,331,2011,March,2014,readSenior Season,"Perrotta, Tom",,3.62,St. Martin's Press,ebook,32,2011,June,2015,to-readSeveneves,"Stephenson, Neal",,4.02,William Morrow,ebook,880,2015,April,2015,to-readSex and the Single Zillionaire: A Novel,"Perkins, Tom",3,2.56,William Morrow,Hardcover,304,2006,July,2011,readShotgun Lovesongs,Nickolas Butler,5,3.77,Thomas Dunne Books,Hardcover,320,2014,September,2015,readSignifying Rappers: Rap and Race in the Urban Present,"Costello, Mark",5,3.33,Ecco Press,Paperback,140,1990,August,2015,readSkate for Goal! Highlights from Minnesota's State Hockey Tournamant,"Phillips, Gary L.",5,5,Afton Press,Paperback,123,1982,June,2015,readSlam,"Hornby, Nick",5,3.27,G.P. Putnam's Sons Books for Young Readers,Hardcover,309,2007,December,2010,readSmall Country: Stories,"Hornby, Nick",,3.1,Kiepenheuer & Witsch,,158,2011,September,2011,to-readSolar,"McEwan, Ian",4,3.21,Random House,Hardcover,287,2010,December,2014,read"Solitude Creek (Kathryn Dance, #4)","Deaver, Jeffery",,3.8,Grand Central Publishing,Hardcover,464,2015,April,2015,to-readSpeak of the Devil: a Novel,"Hawke, Richard",4,3.54,Random House,Hardcover,336,2006,May,2011,readSpeaking In Tongues,"Deaver, Jeffery",5,3.75,Simon & Schuster,Hardcover,336,1995,February,2011,readStatistical Evidence,"Royall, Richard",4,4,CRC Press,Hardcover,191,1997,April,2013,readStatistics Done Wrong: The Woefully Complete Guide,"Reinhart, Alex",4,4.15,No Starch Press,Paperback,176,2013,May,2015,readStatler Bros. Random Memories,"Reid, Harold",4,4.41,Yell Publishing Company,Hardcover,288,2008,July,2011,readSteve Jobs,"Isaacson, Walter",4,4.09,Simon & Schuster,Hardcover,656,2011,September,2014,readStone's Fall,"Pears, Iain",,3.85,Spiegel & Grau,Hardcover,594,2009,August,2011,quit-readingStop Stealing Sheep & Find Out How Type Works,Erik Spiekermann,4,3.89,Adobe Press,Paperback,213,2013,December,2015,readStory of My Life,"McInerney, Jay",4,3.58,Atlantic Monthly Press,Hardcover,189,1988,August,2013,readStraight Man,"Russo, Richard",5,4.02,Random House USA Inc,Hardcover,391,1997,November,2013,readStylized: A Slightly Obsessive History of Strunk & White's The Elements of Style,"Garvey, Mark",3,3.76,Touchstone,Hardcover,208,2009,January,2011,readSuccess,"Amis, Martin",4,3.65,Harmony,Hardcover,224,1978,February,2013,readSupreme Courtship,"Buckley, Christopher",4,3.63,Grand Central Publishing,Hardcover,304,2008,March,2013,readSweet Tooth,"McEwan, Ian",5,3.39,Nan A. Talese,Hardcover,301,2012,April,2013,read"Sycamore Row (Jake Brigance, #2)","Grisham, John",4,3.95,Doubleday,Hardcover,447,2013,August,2014,readTalking to Girls About Duran Duran: One Young Man's Quest for True Love and a Cooler Haircut,"Sheffield, Rob",5,3.56,Dutton,Hardcover,288,2010,February,2011,readTampa,"Nutting, Alissa",4,3.3,Ecco,ebook,272,2013,November,2014,readTelegraph Avenue,"Chabon, Michael",5,3.35,Fourth Estate,Hardcover,468,2012,January,2013,readTen Years in the Tub: A Decade Soaking in Great Books,"Hornby, Nick",,4.04,"McSweeney's, Believer Books",Hardcover,464,2013,November,2013,to-readTequila Mockingbird: Cocktails with a Literary Twist,"Federle, Tim",,4.06,Running Press,Hardcover,160,2013,December,2014,to-readThat Old Cape Magic,"Russo, Richard",4,3.28,Knopf,Hardcover,261,2009,March,2014,read"The 500 (Mike Ford, #1)","Quirk, Matthew",3,3.44,Reagan Arthur Books,Hardcover,336,2012,January,2015,readThe Advocate's Devil,"Dershowitz, Alan M.",3,3.4,Grand Central Publishing,Hardcover,352,1994,March,2014,readThe Art Of The Footnote: The Intelligent Student's Guide To The Art And Science Of Annotating Texts,"Burkle-Young, Francis A.",,0,University Press of America,Hardcover,168,1996,April,2015,to-readThe Art Thief,"Charney, Noah",4,2.98,Atria Books,Hardcover,304,2007,August,2011,read"The Artist and the Mathematician: The Story of Nicolas Bourbaki, the Genius Mathematician Who Never Existed","Aczel, Amir D.",,3.19,Basic Books,Hardcover,272,2006,January,2014,quit-readingThe Associate,John Grisham,4,3.63,Doubleday Books,Hardcover,373,2009,December,2015,readThe Astronaut Wives Club,"Koppel, Lily",3,3.22,Grand Central Publishing,Hardcover,288,2013,April,2015,read"The Bone Woman: A Forensic Anthropologist's Search for Truth in the Mass Graves of Rwanda, Bosnia, Croatia, and Kosovo","Koff, Clea",,4.03,Random House Trade Paperbacks,Paperback,304,2001,April,2012,quit-readingThe Book of Vice: Very Naughty Things (and How to Do Them),"Sagal, Peter",4,3.43,Dey Street Books,Hardcover,272,2007,November,2011,readThe Boy Who Fell Out of the Sky,"Dornstein, Ken",3,3.48,Random House,Hardcover,320,2006,December,2010,readThe Broker,John Grisham,3,3.75,Doubleday Books,Hardcover,357,2005,December,2015,read"The Caravaggio Conspiracy: How Five Art Dealers, Four Policemen, Three Picture Restorers, Two Auction Houses, and a Journalist Plotted to Recover Some of the World's Most Beautiful Stolen Paintings","Watson, Peter",,3.56,Doubleday Books,Hardcover,321,1983,February,2014,quit-readingThe Children Act,"McEwan, Ian",,3.66,Nan A. Talese,Hardcover,240,2014,October,2014,to-readThe CIA Document of Human Manipulation: Kubark Counterintelligence Interrogation Manual,Central Intelligence Agency (C.I.A.),3,3.37,Createspace,Paperback,128,2008,November,2015,readThe Computer from Pascal to Von Neumann,"Goldstine, Herman H.",2,3.53,Princeton University Press,Hardcover,378,1972,February,2011,readThe Confession,"Grisham, John",5,3.77,Doubleday,Hardcover,418,2010,November,2011,readThe Death and Life of Charlie St. Cloud,"Sherwood, Ben",5,3.99,Bantam Books,Hardcover,288,2004,February,2015,readThe Death of a President: November 1963,"Manchester, William",,4.22,"Harper & Row, Publishers",Hardcover,711,1967,August,2013,quit-readingThe Devil's Details: A History of the Footnote,"Zerby, Chuck",4,3.36,Invisible Cities Press Llc,Hardcover,192,2001,November,2010,readThe Devotion of Suspect X,"Higashino, Keigo",3,3.94,Minotaur Books,Hardcover,298,2005,May,2013,readThe Elements of Style,"Jr., William Strunk",5,4.18,Longman Publishing Group,Hardcover,105,1918,March,2014,read"The Eyre Affair (Thursday Next, #1)","Fforde, Jasper",,3.92,Penguin Putnam,Hardcover,374,2001,February,2011,quit-readingThe Fan Man,"Kotzwinkle, William",,4.15,Vintage,Paperback,191,1974,June,2011,to-readThe Footprints of God,"Iles, Greg",3,3.76,Brilliance Audio,Hardcover,463,2003,January,2015,readThe Fuck-Up,"Nersesian, Arthur",,3.53,MTV Books,Paperback,304,1997,June,2011,to-read"The Girl Who Kicked the Hornet's Nest (Millennium, #3)","Larsson, Stieg",3,4.18,Knopf,Hardcover,563,2007,February,2011,read"The Girl with the Dragon Tattoo (Millennium, #1)","Larsson, Stieg",3,4.07,Knopf,Hardcover,465,2005,April,2011,read"The Givenchy Code (Codebreaker Trilogy, #1)","Kenner, Julie",3,3.59,Pocket Books,Paperback,368,2005,November,2011,readThe Good Life,"McInerney, Jay",4,3.34,Knopf,Hardcover,368,2006,August,2013,readThe Humanity Project,"Thompson, Jean",4,3.28,Blue Rider Press,Hardcover,352,2013,August,2015,read"The Hunger Games (The Hunger Games, #1)","Collins, Suzanne",4,4.38,Scholastic Press,Hardcover,374,2008,May,2012,readThe Icarus Agenda,"Ludlum, Robert",,3.9,Random House,Hardcover,677,1988,May,2014,quit-readingThe Immortal Life of Henrietta Lacks,"Skloot, Rebecca",,4.02,Crown Publishing Group,Hardcover,370,2010,September,2014,quit-readingThe Innocent,"McEwan, Ian",4,3.68,Vintage,Hardcover,226,1990,February,2015,read"The It Girl (It Girl, #1)","Ziegesar, Cecily von",5,3.66,Poppy,Paperback,263,2005,January,2015,readThe Kill Room,"Deaver, Jeffery",3,3.79,Grand Central Publishing,Hardcover,484,2013,December,2013,readThe King of Methlehem: A Novel,"Lindquist, Mark",4,3.2,Simon & Schuster,Hardcover,256,2007,April,2013,readThe Know-It-All: One Man's Humble Quest to Become the Smartest Person in the World,"Jacobs, A.J.",4,3.77,Simon & Schuster,Hardcover,386,2004,May,2012,readThe Last Bookaneer,"Pearl, Matthew",,3.36,Harvill Secker,Hardcover,400,2015,April,2015,to-readThe Last Dickens,"Pearl, Matthew",4,3.54,Random House (NY),Hardcover,386,2009,June,2012,readThe Last of the Savages,"McInerney, Jay",5,3.66,Knopf,Hardcover,271,1996,February,2014,readThe Latehomecomer: A Hmong Family Memoir,"Yang, Kao Kalia",,4.04,Coffee House Press,Paperback,277,2008,September,2013,to-read